Name,Address,Phone,Website,Google Maps Link
Ethos Watch Boutiques,"UGF Shop No. 9, VR Nagpur Medical Square, to, Baidyanath Square Road, Rambagh Layout, Untkhana, Nagpur, Maharashtra 440003, India",0712 691 7822,https://www.ethoswatches.com/locatestore/entr-nagpur/,https://www.google.com/maps/place/?q=place_id:ChIJBQXr1cbA1DsRjLIxR5t6bio
Renuka Watch Co & gift planet,"215 W High Court Rd, Square, Shankar Nagar, Dharampeth, Nagpur, Maharashtra 440010, India",,,https://www.google.com/maps/place/?q=place_id:ChIJa9vjwmPA1DsRS_3YGosY7DM
Kathale Watches And Gifts,"Kapada Line, Mahadevpura, Wardha, Maharashtra 442001, India",,,https://www.google.com/maps/place/?q=place_id:ChIJHZT4eA1_1DsRv0dsLbL6i2M
Victory Opticals & Watches,"buti building beside bank of india ATM, opposite nilawar sarees jhansi rani sq., wardha road, Sitabuldi, Nagpur, Maharashtra 440012, India",098907 64966,,https://www.google.com/maps/place/?q=place_id:ChIJm6c6l5PA1DsRW-jR1yeBOP8
Jaydev Watch & Belt,"Shop no.G27, NIT Complex, besides morbhavan, sitabuldi, Variety Square, Gorepeth, Nagpur, Maharashtra 440012, India",093713 96796,,https://www.google.com/maps/place/?q=place_id:ChIJHSRGbJPA1DsRpHUtNjV0cSM
Fastrack store,"Shop No. 292B, Plot No. 01, W High Ct Rd, opp. Batukbhai Jewellers, Dharampeth Extension, Dharampeth, Nagpur, Maharashtra 440010, India",094055 81122,https://www.fastrack.in/,https://www.google.com/maps/place/?q=place_id:ChIJqXpAZX7B1DsRcNNZ3Eiv9Yg
Kamal Watch Co. Nagpur,"Alankar Square, Shankar Nagar, East Shankar Nagar, Ramdaspeth, Nagpur, Maharashtra 440010, India",091691 67676,https://www.kamalwatch.com/,https://www.google.com/maps/place/?q=place_id:ChIJ7eStrd_B1DsReDb7_tgz4ts
Titan Store Maharashtra watch & optical,"Khamla Rd, near life care hospital, Khamla, Nagpur, Maharashtra 440025, India",086685 19812,http://maharashtrawatchco.com/,https://www.google.com/maps/place/?q=place_id:ChIJLQGzZiS_1DsRBPmQHHj28ig
Lucky Watches & opticals,"Bohra Masjid Road Resham Oli, Itwari, Resham Oli, Tandapeth, Nagpur, Maharashtra 440002, India",097605 41376,https://instagram.com/lw_studio1?utm_medium=copy_link,https://www.google.com/maps/place/?q=place_id:ChIJEY6KPc3A1DsRn-MdcVaqNDU
Amit Watch,"Shop No 1, Ashtbhuja Chauk, Bachelor Road, Sudampuri, Wardha, Maharashtra 442001, India",098900 48435,,https://www.google.com/maps/place/?q=place_id:ChIJEftDYBx_1DsRgH-5zBira8M
